title,html_url,number
Annual Review - Mainframe Open Education - 6/8,https://github.com/openmainframeproject/tac/issues/494,494
Swag Proposal for Open Mainframe Project Slack to Reduce Channel Pollution,https://github.com/openmainframeproject/tac/issues/484,484
Add information on mainframe infrastructure,https://github.com/openmainframeproject/tac/pull/481,481
CD Foundation Best Practices SIG,https://github.com/openmainframeproject/tac/issues/460,460
Annual Review - COBOL Check - 6/8,https://github.com/openmainframeproject/tac/issues/449,449
